id,overview,tagline,title,comb
522016,"A group of top female agents from American, British, Chinese, Colombian, and German government agencies are drawn together to try and stop an organization from acquiring a deadly weapon to send the world into chaos.",Work together or die alone.,The 355,"A group of top female agents from American, British, Chinese, Colombian, and German government agencies are drawn together to try and stop an organization from acquiring a deadly weapon to send the world into chaos.Work together or die alone."
739890,"While sleeping, a group of campers hear an ominous cry. They wake to find themselves stranded with the wrath of La Llorona.",,The Legend of La Llorona,"While sleeping, a group of campers hear an ominous cry. They wake to find themselves stranded with the wrath of La Llorona."
753232,"An elite DEA agent returns home after a failed mission when his family makes an unexpected discovery in their house – a stash of money worth $3 million. They soon face the danger and threat of a newly released criminal and his crew, who will do whatever it takes to retrieve the money, including kidnap the agent’s daughters. Stakes are high and lives are at risk in this head-to-head battle as the agent stops at nothing to protect his family against the money-hungry criminals.",Only one will survive.,The Commando,"An elite DEA agent returns home after a failed mission when his family makes an unexpected discovery in their house – a stash of money worth $3 million. They soon face the danger and threat of a newly released criminal and his crew, who will do whatever it takes to retrieve the money, including kidnap the agent’s daughters. Stakes are high and lives are at risk in this head-to-head battle as the agent stops at nothing to protect his family against the money-hungry criminals.Only one will survive."
766907,An ex-NYPD officer-turned-sheriff of a small rural Georgia town has to contend with a gang of thieves who have taken a wealthy doctor hostage.,No one walks away.,American Siege,An ex-NYPD officer-turned-sheriff of a small rural Georgia town has to contend with a gang of thieves who have taken a wealthy doctor hostage.No one walks away.
646385,"Twenty-five years after a streak of brutal murders shocked the quiet town of Woodsboro, a new killer has donned the Ghostface mask and begins targeting a group of teenagers to resurrect secrets from the town’s deadly past.",It's always someone you know.,Scream,"Twenty-five years after a streak of brutal murders shocked the quiet town of Woodsboro, a new killer has donned the Ghostface mask and begins targeting a group of teenagers to resurrect secrets from the town’s deadly past.It's always someone you know."
585083,"When Van Helsing's mysterious invention, the ""Monsterfication Ray,"" goes haywire, Drac and his monster pals are all transformed into humans, and Johnny becomes a monster. In their new mismatched bodies, Drac and Johnny must team up and race across the globe to find a cure before it's too late, and before they drive each other crazy.",Change can be scary.,Hotel Transylvania: Transformania,"When Van Helsing's mysterious invention, the ""Monsterfication Ray,"" goes haywire, Drac and his monster pals are all transformed into humans, and Johnny becomes a monster. In their new mismatched bodies, Drac and Johnny must team up and race across the globe to find a cure before it's too late, and before they drive each other crazy.Change can be scary."
844398,"Chris, a wealthy divorcee, lives in a high-tech house of his own design in Montana. His life changes when he meets Sky, a mysterious young woman who draws him out of his shell and moves in after Chris is injured.",She'll love him to death.,Shattered,"Chris, a wealthy divorcee, lives in a high-tech house of his own design in Montana. His life changes when he meets Sky, a mysterious young woman who draws him out of his shell and moves in after Chris is injured.She'll love him to death."
790142,"Isabella runs her own salon and isn’t afraid to speak her mind, while Prince Thomas runs his own country and is about to marry for duty rather than love. When Izzy and her fellow stylists get the opportunity of a lifetime to do the hair for the royal wedding, she and Prince Thomas learn that taking control of their own destiny requires following their hearts.",,The Royal Treatment,"Isabella runs her own salon and isn’t afraid to speak her mind, while Prince Thomas runs his own country and is about to marry for duty rather than love. When Izzy and her fellow stylists get the opportunity of a lifetime to do the hair for the royal wedding, she and Prince Thomas learn that taking control of their own destiny requires following their hearts."
698508,A retelling of the biblical book of Hosea set against the backdrop of the California Gold Rush of 1850.,Never look back. Never look forward.,Redeeming Love,A retelling of the biblical book of Hosea set against the backdrop of the California Gold Rush of 1850.Never look back. Never look forward.
245842,"King Louis XIV's quest for immortality leads him to capture and steal a mermaid's life force, a move that is further complicated by his illegitimate daughter's discovery of the creature.",What on Earth can hold more power than a king?,The King's Daughter,"King Louis XIV's quest for immortality leads him to capture and steal a mermaid's life force, a move that is further complicated by his illegitimate daughter's discovery of the creature.What on Earth can hold more power than a king?"
793269,"When 12-year-old Rob Horton discovers a caged tiger in the woods near his home, his imagination runs wild and life begins to change in the most unexpected ways. With the help of a wise and mysterious maid, Willie May  and the stubborn new girl in school, he must navigate through childhood memories, heartache, and wondrous adventures.",Let your imagination run wild.,The Tiger Rising,"When 12-year-old Rob Horton discovers a caged tiger in the woods near his home, his imagination runs wild and life begins to change in the most unexpected ways. With the help of a wise and mysterious maid, Willie May  and the stubborn new girl in school, he must navigate through childhood memories, heartache, and wondrous adventures.Let your imagination run wild."
801691,An evil cult unleashes a monster on a small south-western town that refuses to go down without a fight.,,Hellblazers,An evil cult unleashes a monster on a small south-western town that refuses to go down without a fight.
795514,"In the wake of a school tragedy, Vada, Mia and Quinton form a unique and dynamic bond as they navigate the never linear, often confusing journey to heal in a world that feels forever changed.",Nothing will ever be the same.,The Fallout,"In the wake of a school tragedy, Vada, Mia and Quinton form a unique and dynamic bond as they navigate the never linear, often confusing journey to heal in a world that feels forever changed.Nothing will ever be the same."
817648,"Two years after a Super Bowl win when NFL head coach Sean Payton is suspended, he goes back to his hometown and finds himself reconnecting with his 12-year-old son by coaching his Pop Warner football team.",Life doesn't have a playbook.,Home Team,"Two years after a Super Bowl win when NFL head coach Sean Payton is suspended, he goes back to his hometown and finds himself reconnecting with his 12-year-old son by coaching his Pop Warner football team.Life doesn't have a playbook."
774825,The fearless one-eyed weasel Buck teams up with mischievous possum brothers Crash & Eddie as they head off on a new adventure into Buck's home: The Dinosaur World.,Disney+ gets wild.,The Ice Age Adventures of Buck Wild,The fearless one-eyed weasel Buck teams up with mischievous possum brothers Crash & Eddie as they head off on a new adventure into Buck's home: The Dinosaur World.Disney+ gets wild.
689700,"Tormented by a past life, garbage man Clean attempts a life of quiet redemption. But when his good intentions mark him a target of a local crime boss, Clean is forced to reconcile with the violence of his past.",Revenge is a dirty business.,Clean,"Tormented by a past life, garbage man Clean attempts a life of quiet redemption. But when his good intentions mark him a target of a local crime boss, Clean is forced to reconcile with the violence of his past.Revenge is a dirty business."
854359,"When a distant emergency disrupts a vacation in Acapulco, simmering tensions rise to the fore between scions of a wealthy British family.",,Sundown,"When a distant emergency disrupts a vacation in Acapulco, simmering tensions rise to the fore between scions of a wealthy British family."
656663,"Celebrate the joy of a perfectly executed shot to the groin as Johnny Knoxville, Steve-O and the rest of the gang return alongside some newcomers for one final round of hilarious, wildly absurd and often dangerous displays of stunts and comedy.",Some people never learn.,Jackass Forever,"Celebrate the joy of a perfectly executed shot to the groin as Johnny Knoxville, Steve-O and the rest of the gang return alongside some newcomers for one final round of hilarious, wildly absurd and often dangerous displays of stunts and comedy.Some people never learn."
406759,A mysterious force knocks the moon from its orbit around Earth and sends it hurtling on a collision course with life as we know it.,Humanity will face the dark side of the Moon.,Moonfall,A mysterious force knocks the moon from its orbit around Earth and sends it hurtling on a collision course with life as we know it.Humanity will face the dark side of the Moon.
557946,"A disgraced ex-cop seeks solace by moving to the woods, but his quiet life comes to an end when a private eye recruits him to investigate the murder of an eccentric TV star's wife.",This city is a bad place to be a good guy.,Last Looks,"A disgraced ex-cop seeks solace by moving to the woods, but his quiet life comes to an end when a private eye recruits him to investigate the murder of an eccentric TV star's wife.This city is a bad place to be a good guy."
925705,A devoted couple's quiet weekend takes a bizarre turn when a nightmarish cult and their maniacal leader come to fulfill an apocalyptic prophesy.,,The Long Night,A devoted couple's quiet weekend takes a bizarre turn when a nightmarish cult and their maniacal leader come to fulfill an apocalyptic prophesy.
800510,"A tech worker with agoraphobia discovers recorded evidence of a violent crime but is met with resistance when she tries to report it. Seeking justice, she must do the thing she fears the most: leave her apartment.",She's not the only one listening.,Kimi,"A tech worker with agoraphobia discovers recorded evidence of a violent crime but is met with resistance when she tries to report it. Seeking justice, she must do the thing she fears the most: leave her apartment.She's not the only one listening."
629015,A young single mother is held captive along with her two children by a violent ex and must plot their escape before it’s too late.,The will to live is found within.,Shut In,A young single mother is held captive along with her two children by a violent ex and must plot their escape before it’s too late.The will to live is found within.
505026,Belgian sleuth Hercule Poirot boards a glamorous river steamer with enough champagne to fill the Nile. But his Egyptian vacation turns into a thrilling search for a murderer when a picture-perfect couple’s idyllic honeymoon is tragically cut short.,Murder was just the beginning.,Death on the Nile,Belgian sleuth Hercule Poirot boards a glamorous river steamer with enough champagne to fill the Nile. But his Egyptian vacation turns into a thrilling search for a murderer when a picture-perfect couple’s idyllic honeymoon is tragically cut short.Murder was just the beginning.
615904,"Music superstars Kat Valdez and Bastian are getting married before a global audience of fans. But when Kat learns, seconds before her vows, that Bastian has been unfaithful, she decides to marry Charlie, a stranger in the crowd, instead.",Say yes.,Marry Me,"Music superstars Kat Valdez and Bastian are getting married before a global audience of fans. But when Kat learns, seconds before her vows, that Bastian has been unfaithful, she decides to marry Charlie, a stranger in the crowd, instead.Say yes."
823625,Travis Block is a shadowy Government agent who specializes in removing operatives whose covers have been exposed. He then has to uncover a deadly conspiracy within his own ranks that reaches the highest echelons of power.,They're gonna need more men.,Blacklight,Travis Block is a shadowy Government agent who specializes in removing operatives whose covers have been exposed. He then has to uncover a deadly conspiracy within his own ranks that reaches the highest echelons of power.They're gonna need more men.
680860,"Peter and Emma thought they were on the precipice of life’s biggest moments – marriage, kids, and houses in the suburbs – until their respective partners dumped them. Horrified to learn that the loves of their lives have already moved on, Peter and Emma hatch a hilarious plan to win back their exes with unexpected results.",Their exes have moved on. They haven't.,I Want You Back,"Peter and Emma thought they were on the precipice of life’s biggest moments – marriage, kids, and houses in the suburbs – until their respective partners dumped them. Horrified to learn that the loves of their lives have already moved on, Peter and Emma hatch a hilarious plan to win back their exes with unexpected results.Their exes have moved on. They haven't."
772272,"After Jodi Kreyman gains popularity, her miscommunications start causing rifts with those around her and now she really needs to ""stand tall"".",Growing up is a tall order.,Tall Girl 2,"After Jodi Kreyman gains popularity, her miscommunications start causing rifts with those around her and now she really needs to ""stand tall"".Growing up is a tall order."
640265,"Lennie is a teen musical prodigy grieving the death of her sister when she finds herself caught between a new guy at school and her sister's devastated boyfriend. Through her vivid imagination and conflicted heart, Lennie navigates first love and first loss.",Live fearlessly. Love endlessly.,The Sky Is Everywhere,"Lennie is a teen musical prodigy grieving the death of her sister when she finds herself caught between a new guy at school and her sister's devastated boyfriend. Through her vivid imagination and conflicted heart, Lennie navigates first love and first loss.Live fearlessly. Love endlessly."
818750,"After surviving a car accident that took the life of her boyfriend, a teenage girl believes he's attempting to reconnect with her from the after world.",Love never dies.,The In Between,"After surviving a car accident that took the life of her boyfriend, a teenage girl believes he's attempting to reconnect with her from the after world.Love never dies."
890656,A revenge mission becomes a fight to save the world from an ancient threat when superpowered assassin Kai tracks a killer to Bangkok.,,Fistful of Vengeance,A revenge mission becomes a fight to save the world from an ancient threat when superpowered assassin Kai tracks a killer to Bangkok.
335787,"A young street-smart, Nathan Drake and his wisecracking partner Victor “Sully” Sullivan embark on a dangerous pursuit of “the greatest treasure never found” while also tracking clues that may lead to Nathan’s long-lost brother.",Fortune favors the bold.,Uncharted,"A young street-smart, Nathan Drake and his wisecracking partner Victor “Sully” Sullivan embark on a dangerous pursuit of “the greatest treasure never found” while also tracking clues that may lead to Nathan’s long-lost brother.Fortune favors the bold."
626735,An army ranger and his dog embark on a road trip along the Pacific Coast Highway to attend a friend's funeral.,A filthy animal unfit for human company and a... dog.,Dog,An army ranger and his dog embark on a road trip along the Pacific Coast Highway to attend a friend's funeral.A filthy animal unfit for human company and a... dog.
632727,"After nearly 50 years of hiding, Leatherface returns to terrorize a group of idealistic influencers who accidentally disrupt his carefully shielded world in a remote Texas town.",The face of madness returns.,Texas Chainsaw Massacre,"After nearly 50 years of hiding, Leatherface returns to terrorize a group of idealistic influencers who accidentally disrupt his carefully shielded world in a remote Texas town.The face of madness returns."
630392,"In the late 19th century, a brutal land baron slaughters a Roma clan, unleashing a curse on his family and village. In the days that follow, the townspeople are plagued by nightmares, the baron's son goes missing, and a boy is found murdered. The locals suspect a wild animal, but a visiting pathologist warns of a more sinister presence lurking in the woods.",,The Cursed,"In the late 19th century, a brutal land baron slaughters a Roma clan, unleashing a curse on his family and village. In the days that follow, the townspeople are plagued by nightmares, the baron's son goes missing, and a boy is found murdered. The locals suspect a wild animal, but a visiting pathologist warns of a more sinister presence lurking in the woods."
830027,A stubborn teenage girl finds herself confronted by whimsical characters when she is transported into a world of fantasy and fairy tales while attending a school marionette show.,An adventure beyond your imagination.,A Fairy Tale After All,A stubborn teenage girl finds herself confronted by whimsical characters when she is transported into a world of fantasy and fairy tales while attending a school marionette show.An adventure beyond your imagination.
730047,"A man ahead of his time, Cyrano de Bergerac dazzles whether with ferocious wordplay at a verbal joust or with brilliant swordplay in a duel. But, convinced that his appearance renders him unworthy of the love of a devoted friend, the luminous Roxanne, Cyrano has yet to declare his feelings for her—and Roxanne has fallen in love, at first sight, with Christian.",Have you ever loved someone?,Cyrano,"A man ahead of his time, Cyrano de Bergerac dazzles whether with ferocious wordplay at a verbal joust or with brilliant swordplay in a duel. But, convinced that his appearance renders him unworthy of the love of a devoted friend, the luminous Roxanne, Cyrano has yet to declare his feelings for her—and Roxanne has fallen in love, at first sight, with Christian.Have you ever loved someone?"
895744,"Legendary rock band Foo Fighters move into an Encino mansion steeped in grisly rock and roll history to record their much anticipated 10th album. Once in the house, Dave Grohl finds himself grappling with supernatural forces that threaten both the completion of the album and the lives of the band.",He gives new meaning to a killer track.,Studio 666,"Legendary rock band Foo Fighters move into an Encino mansion steeped in grisly rock and roll history to record their much anticipated 10th album. Once in the house, Dave Grohl finds himself grappling with supernatural forces that threaten both the completion of the album and the lives of the band.He gives new meaning to a killer track."
845404,Madea's back - hallelujer! And she's not putting up with any nonsense as family drama erupts at her great-grandson's college graduation celebration.,It's a family affair.,A Madea Homecoming,Madea's back - hallelujer! And she's not putting up with any nonsense as family drama erupts at her great-grandson's college graduation celebration.It's a family affair.
833425,"Stranded at a rest stop in the mountains during a blizzard, a recovering addict discovers a kidnapped child hidden in a car belonging to one of the people inside the building which sets her on a terrifying struggle to identify who among them is the kidnapper.",Who will survive the dead of winter?,No Exit,"Stranded at a rest stop in the mountains during a blizzard, a recovering addict discovers a kidnapped child hidden in a car belonging to one of the people inside the building which sets her on a terrifying struggle to identify who among them is the kidnapper.Who will survive the dead of winter?"
916821,"A man implicated in the triple homicide of three Hollywood starlets begins his own investigation. Needing assistance, he enlists the two detectives on his tail in order to expose a conspiracy more explosive than any of them imagined.",Justice gets dirty.,Gasoline Alley,"A man implicated in the triple homicide of three Hollywood starlets begins his own investigation. Needing assistance, he enlists the two detectives on his tail in order to expose a conspiracy more explosive than any of them imagined.Justice gets dirty."
414906,"In his second year of fighting crime, Batman uncovers corruption in Gotham City that connects to his own family while facing a serial killer known as the Riddler.",Unmask the truth.,The Batman,"In his second year of fighting crime, Batman uncovers corruption in Gotham City that connects to his own family while facing a serial killer known as the Riddler.Unmask the truth."
585378,"When his young daughter's beloved companion — an android named Yang — malfunctions, Jake searches for a way to repair him. In the process, Jake discovers the life that has been passing in front of him, reconnecting with his wife and daughter across a distance he didn't know was there.",The future has never looked so human.,After Yang,"When his young daughter's beloved companion — an android named Yang — malfunctions, Jake searches for a way to repair him. In the process, Jake discovers the life that has been passing in front of him, reconnecting with his wife and daughter across a distance he didn't know was there.The future has never looked so human."
787752,"Frustrated by scrolling dating apps only to end up on lame, tedious dates, Noa takes a chance by giving her number to the awkwardly charming Steve after a produce-section meet-cute at the grocery store.",It’s not for everyone.,Fresh,"Frustrated by scrolling dating apps only to end up on lame, tedious dates, Noa takes a chance by giving her number to the awkwardly charming Steve after a produce-section meet-cute at the grocery store.It’s not for everyone."
864116,"A disgraced parole officer is indebted to a local gang leader and forced to pull off a series of dangerous drug heists within twelve hours in order to pay the $2 million dollars he owes, rescue his kidnapped pregnant wife, and settle a score with the city's corrupt police chief, who is working with the gang leader and double-crossed him years ago.",Only the savage survive.,A Day to Die,"A disgraced parole officer is indebted to a local gang leader and forced to pull off a series of dangerous drug heists within twelve hours in order to pay the $2 million dollars he owes, rescue his kidnapped pregnant wife, and settle a score with the city's corrupt police chief, who is working with the gang leader and double-crossed him years ago.Only the savage survive."
696806,"After accidentally crash-landing in 2022, time-traveling fighter pilot Adam Reed teams up with his 12-year-old self on a mission to save the future.",Past meets future.,The Adam Project,"After accidentally crash-landing in 2022, time-traveling fighter pilot Adam Reed teams up with his 12-year-old self on a mission to save the future.Past meets future."
508947,"Thirteen-year-old Mei is experiencing the awkwardness of being a teenager with a twist – when she gets too excited, she transforms into a giant red panda.",Growing up is a beast.,Turning Red,"Thirteen-year-old Mei is experiencing the awkwardness of being a teenager with a twist – when she gets too excited, she transforms into a giant red panda.Growing up is a beast."
860852,"When fifteen-year-old Tyson attends public school for the first time, his life is changed forever. While helping his father clean up after the football team, Tyson befriends champion marathon runner Aklilu. Never letting his autism hold him back, Tyson becomes determined to run his first marathon in hopes of winning his father's approval.  With the help of an unlikely friend and his parents, Tyson learns that with faith in yourself and the courage to take the first step, anything is possible.",With each step comes the determination to take another.,Tyson's Run,"When fifteen-year-old Tyson attends public school for the first time, his life is changed forever. While helping his father clean up after the football team, Tyson befriends champion marathon runner Aklilu. Never letting his autism hold him back, Tyson becomes determined to run his first marathon in hopes of winning his father's approval.  With the help of an unlikely friend and his parents, Tyson learns that with faith in yourself and the courage to take the first step, anything is possible.With each step comes the determination to take another."
921655,"Chasing his dream to join an elite K-9 unit, a state trooper partners with a fellow underdog: clever but naughty shelter pup Ruby. Based on a true story.",,Rescued by Ruby,"Chasing his dream to join an elite K-9 unit, a state trooper partners with a fellow underdog: clever but naughty shelter pup Ruby. Based on a true story."
