id,overview,tagline,title,comb
502356,"A plumber named Mario travels through an underground labyrinth with his brother, Luigi, trying to save a captured princess.",,Bros,"A plumber named Mario travels through an underground labyrinth with his brother, Luigi, trying to save a captured princess."
642885,"29 years since the Black Flame Candle was last lit, the 17th-century Sanderson sisters are resurrected, and they are looking for revenge. Now it's up to three high school students to stop the ravenous witches from wreaking a new kind of havoc on Salem before dawn on All Hallow's Eve.",Back and more glorious than ever.,Hocus Pocus 2,"29 years since the Black Flame Candle was last lit, the 17th-century Sanderson sisters are resurrected, and they are looking for revenge. Now it's up to three high school students to stop the ravenous witches from wreaking a new kind of havoc on Salem before dawn on All Hallow's Eve.Back and more glorious than ever."
597922,"Chickie wants to support his friends fighting in Vietnam, so he does something wild—personally bring them American beer. What starts as a well-meaning journey quickly changes Chickie’s life and perspective. Based on a true story.",Friendship has no last call.,The Greatest Beer Run Ever,"Chickie wants to support his friends fighting in Vietnam, so he does something wild—personally bring them American beer. What starts as a well-meaning journey quickly changes Chickie’s life and perspective. Based on a true story.Friendship has no last call."
633657,"Hildy Good, a wry New England realtor and descendant of the Salem witches who loves her wine and loves her secrets. Her compartmentalized life starts to unravel as she rekindles an old romance and becomes dangerously entwined in one person’s reckless behavior.",,The Good House,"Hildy Good, a wry New England realtor and descendant of the Salem witches who loves her wine and loves her secrets. Her compartmentalized life starts to unravel as she rekindles an old romance and becomes dangerously entwined in one person’s reckless behavior."
799546,A successful woman in New York City finds her life upended when she is forced to confront a dark truth that threatens to unravel her meticulously crafted life.,,Luckiest Girl Alive,A successful woman in New York City finds her life upended when she is forced to confront a dark truth that threatens to unravel her meticulously crafted life.
828558,"In a windswept fishing village, a mother is torn between protecting her beloved son and her own sense of right and wrong. A lie she tells for him rips apart their family and close-knit community.",A Mother's Love Forsaken.,God's Creatures,"In a windswept fishing village, a mother is torn between protecting her beloved son and her own sense of right and wrong. A lie she tells for him rips apart their family and close-knit community.A Mother's Love Forsaken."
843380,"In 1897, veteran bounty hunter Max Borlund is deep into Mexico where he encounters professional gambler and outlaw Joe Cribbens — a sworn enemy he sent to prison years before. Max is on a mission to find and return Rachel Kidd, the wife of a wealthy businessman, who as the story is told to Max, has been abducted by Buffalo Soldier Elijah Jones. Max is ultimately faced with a showdown to save honor.",Vengeance for the right price.,Dead for a Dollar,"In 1897, veteran bounty hunter Max Borlund is deep into Mexico where he encounters professional gambler and outlaw Joe Cribbens — a sworn enemy he sent to prison years before. Max is on a mission to find and return Rachel Kidd, the wife of a wealthy businessman, who as the story is told to Max, has been abducted by Buffalo Soldier Elijah Jones. Max is ultimately faced with a showdown to save honor.Vengeance for the right price."
816952,"The year is 1988. Abby and Gretchen have been best friends since fourth grade. After an evening of skinny-dipping goes disastrously wrong, Gretchen begins to act…different, which leads Abby to suspect her best friend may be possessed by a demon. With help from some unlikely allies, Abby embarks on a quest to save Gretchen. But is their friendship powerful enough to beat the devil?",True friendship is worth going to hell and back.,My Best Friend's Exorcism,"The year is 1988. Abby and Gretchen have been best friends since fourth grade. After an evening of skinny-dipping goes disastrously wrong, Gretchen begins to act…different, which leads Abby to suspect her best friend may be possessed by a demon. With help from some unlikely allies, Abby embarks on a quest to save Gretchen. But is their friendship powerful enough to beat the devil?True friendship is worth going to hell and back."
1024836,"Follows the tumultuous relationship—in and out of court—of Johnny Depp and his ex-wife, Amber Heard.",,Hot Take: The Depp/Heard Trial,"Follows the tumultuous relationship—in and out of court—of Johnny Depp and his ex-wife, Amber Heard."
723419,"Craig, a young boy living in a small town befriends an older, reclusive billionaire, Mr. Harrigan. The two form a bond over books and an iPhone, but when the man passes away the boy discovers that not everything dead is gone.",Some connections never die.,Mr. Harrigan's Phone,"Craig, a young boy living in a small town befriends an older, reclusive billionaire, Mr. Harrigan. The two form a bond over books and an iPhone, but when the man passes away the boy discovers that not everything dead is gone.Some connections never die."
663712,"After being resurrected by a sinister entity, Art the Clown returns to Miles County where he must hunt down and destroy a teenage girl and her younger brother on Halloween night.  As the body count rises, the siblings fight to stay alive while uncovering the true nature of Art's evil intent.",Who's laughing now?,Terrifier 2,"After being resurrected by a sinister entity, Art the Clown returns to Miles County where he must hunt down and destroy a teenage girl and her younger brother on Halloween night.  As the body count rises, the siblings fight to stay alive while uncovering the true nature of Art's evil intent.Who's laughing now?"
830784,"When the Primm family moves to New York City, their young son Josh struggles to adapt to his new school and new friends. All of that changes when he discovers Lyle — a singing crocodile who loves baths, caviar and great music — living in the attic of his new home. But when Lyle’s existence is threatened by evil neighbor Mr. Grumps, the Primms must band together to show the world that family can come from the most unexpected places.",He knows every scale.,"Lyle, Lyle, Crocodile","When the Primm family moves to New York City, their young son Josh struggles to adapt to his new school and new friends. All of that changes when he discovers Lyle — a singing crocodile who loves baths, caviar and great music — living in the attic of his new home. But when Lyle’s existence is threatened by evil neighbor Mr. Grumps, the Primms must band together to show the world that family can come from the most unexpected places.He knows every scale."
664469,"In the 1930s, three friends—a doctor, a nurse, and an attorney—witness a murder, become suspects themselves and uncover one of the most outrageous plots in North American history.","Let the love, murder and conspiracy begin.",Amsterdam,"In the 1930s, three friends—a doctor, a nurse, and an attorney—witness a murder, become suspects themselves and uncover one of the most outrageous plots in North American history.Let the love, murder and conspiracy begin."
817758,"Renowned musician Lydia Tár is days away from recording the symphony that will elevate her career. When all elements seem to conspire against her, Lydia's adopted daughter Petra becomes an integral emotional support for her struggling mother.",,Tár,"Renowned musician Lydia Tár is days away from recording the symphony that will elevate her career. When all elements seem to conspire against her, Lydia's adopted daughter Petra becomes an integral emotional support for her struggling mother."
338947,"A young woman struggling with addiction comes into possession of an ancient puzzle box, unaware that its purpose is to summon the Cenobites, a group of sadistic supernatural beings from another dimension.",Unlock your fears.,Hellraiser,"A young woman struggling with addiction comes into possession of an ancient puzzle box, unaware that its purpose is to summon the Cenobites, a group of sadistic supernatural beings from another dimension.Unlock your fears."
901385,"Ruth and Harry decide to take a romantic backpacking trip through the Pacific Northwest, but amongst the beautiful scenery, Ruth makes an unexpected discovery that sets her off on a strange, frightening new path. The couple aren't alone in the woods, and they might not be the same when they come out...if they come out.",Do you really know the one you love?,Significant Other,"Ruth and Harry decide to take a romantic backpacking trip through the Pacific Northwest, but amongst the beautiful scenery, Ruth makes an unexpected discovery that sets her off on a strange, frightening new path. The couple aren't alone in the woods, and they might not be the same when they come out...if they come out.Do you really know the one you love?"
1018648,"Using unprecedented Olympic footage and behind-the-scenes material, The Redeem Team tells the story of the US Olympic Men's Basketball Team’s quest for gold at the 2008 Olympic Games in Beijing following the previous team’s shocking performance four years earlier in Athens.",Everything to lose. Everything to prove.,The Redeem Team,"Using unprecedented Olympic footage and behind-the-scenes material, The Redeem Team tells the story of the US Olympic Men's Basketball Team’s quest for gold at the 2008 Olympic Games in Beijing following the previous team’s shocking performance four years earlier in Athens.Everything to lose. Everything to prove."
616820,"Four years after the events of Halloween in 2018, Laurie has decided to liberate herself from fear and rage and embrace life. But when a young man is accused of killing a boy he was babysitting, it ignites a cascade of violence and terror that will force Laurie to finally confront the evil she can’t control, once and for all.","This Halloween, their saga ends.",Halloween Ends,"Four years after the events of Halloween in 2018, Laurie has decided to liberate herself from fear and rage and embrace life. But when a young man is accused of killing a boy he was babysitting, it ignites a cascade of violence and terror that will force Laurie to finally confront the evil she can’t control, once and for all.This Halloween, their saga ends."
854239,"The true story of Mamie Till Mobley’s relentless pursuit of justice for her 14 year old son, Emmett Till, who, in 1955, was lynched while visiting his cousins in Mississippi.",Witness the power of a mother’s love.,Till,"The true story of Mamie Till Mobley’s relentless pursuit of justice for her 14 year old son, Emmett Till, who, in 1955, was lynched while visiting his cousins in Mississippi.Witness the power of a mother’s love."
826769,"Left heartbroken after Romeo begins to pursue her cousin Juliet, Rosaline schemes to foil the famous romance and win back her guy in this comedic twist of Shakespeare's Romeo and Juliet.","The love story you know, the ex you don’t.",Rosaline,"Left heartbroken after Romeo begins to pursue her cousin Juliet, Rosaline schemes to foil the famous romance and win back her guy in this comedic twist of Shakespeare's Romeo and Juliet.The love story you know, the ex you don’t."
143,"A young soldier faces profound disillusionment in the soul-destroying horror of World War I. Together with several other young German soldiers, he experiences the horrors of war, such evil of which he had not conceived of when signing up to fight. They eventually become sad, tormented, and confused of their purpose.",They left for war as boys never to return as men.,All Quiet on the Western Front,"A young soldier faces profound disillusionment in the soul-destroying horror of World War I. Together with several other young German soldiers, he experiences the horrors of war, such evil of which he had not conceived of when signing up to fight. They eventually become sad, tormented, and confused of their purpose.They left for war as boys never to return as men."
869025,"Half brothers Raymond and Ray reunite when their estranged father dies—and discover that his final wish was for them to dig his grave. Together, they process who they’ve become as men, both because of their father and in spite of him.",Two brothers. One final request.,Raymond & Ray,"Half brothers Raymond and Ray reunite when their estranged father dies—and discover that his final wish was for them to dig his grave. Together, they process who they’ve become as men, both because of their father and in spite of him.Two brothers. One final request."
603204,"In present-day Nicaragua, a headstrong American journalist and a mysterious English businessman strike up a romance as they become embroiled in a dangerous labyrinth of lies and conspiracies and are forced to try and escape the country.",A sumptuous tale of romance and espionage.,Stars at Noon,"In present-day Nicaragua, a headstrong American journalist and a mysterious English businessman strike up a romance as they become embroiled in a dangerous labyrinth of lies and conspiracies and are forced to try and escape the country.A sumptuous tale of romance and espionage."
864959,A Halloween-hating dad reluctantly teams up with his teenage daughter when an evil spirit wreaks havoc by making their town's decorations come to life.,Halloween comes to life.,The Curse of Bridge Hollow,A Halloween-hating dad reluctantly teams up with his teenage daughter when an evil spirit wreaks havoc by making their town's decorations come to life.Halloween comes to life.
934205,"A gang initiation goes wrong when a group of four recruits break into a house of horror, as they're all forced to play deadly games for their lives.",Who's the bitch ass now?,Bitch Ass,"A gang initiation goes wrong when a group of four recruits break into a house of horror, as they're all forced to play deadly games for their lives.Who's the bitch ass now?"
779782,Best friends Sophie and Agatha navigate an enchanted school for young heroes and villains — and find themselves on opposing sides of the battle between good and evil.,There are two sides to every story.,The School for Good and Evil,Best friends Sophie and Agatha navigate an enchanted school for young heroes and villains — and find themselves on opposing sides of the battle between good and evil.There are two sides to every story.
541134,"Suspicious that her colleague is responsible for a series of mysterious patient deaths, a nurse risks her own life to uncover the truth.",Based on the unthinkable true story.,The Good Nurse,"Suspicious that her colleague is responsible for a series of mysterious patient deaths, a nurse risks her own life to uncover the truth.Based on the unthinkable true story."
1005776,A teenager’s home video leads to a series of horrifying revelations.,VHS goes to hell.,V/H/S/99,A teenager’s home video leads to a series of horrifying revelations.VHS goes to hell.
436270,"Nearly 5,000 years after he was bestowed with the almighty powers of the Egyptian gods—and imprisoned just as quickly—Black Adam is freed from his earthly tomb, ready to unleash his unique form of justice on the modern world.",The world needed a hero. It got Black Adam.,Black Adam,"Nearly 5,000 years after he was bestowed with the almighty powers of the Egyptian gods—and imprisoned just as quickly—Black Adam is freed from his earthly tomb, ready to unleash his unique form of justice on the modern world.The world needed a hero. It got Black Adam."
800939,A divorced couple teams up and travels to Bali to stop their daughter from making the same mistake they think they made 25 years ago.,They’re in this together for better or worse.,Ticket to Paradise,A divorced couple teams up and travels to Bali to stop their daughter from making the same mistake they think they made 25 years ago.They’re in this together for better or worse.
511817,Two demon brothers enlist the aid of Kat Elliot — a tough teen with a load of guilt — to summon them to the Land of the Living. But what Kat demands in return leads to a brilliantly bizarre and comedic adventure like no other.,,Wendell & Wild,Two demon brothers enlist the aid of Kat Elliot — a tough teen with a load of guilt — to summon them to the Land of the Living. But what Kat demands in return leads to a brilliantly bizarre and comedic adventure like no other.
674324,"Two lifelong friends find themselves at an impasse when one abruptly ends their relationship, with alarming consequences for both of them.",Everything was fine yesterday.,The Banshees of Inisherin,"Two lifelong friends find themselves at an impasse when one abruptly ends their relationship, with alarming consequences for both of them.Everything was fine yesterday."
744114,"In the late 1990s, the arrival of elderly invalid Patrick into Marion and Tom’s home triggers the exploration of seismic events from 40 years previous: the passionate relationship between Tom and Patrick at a time when homosexuality was illegal.",Let it take hold of you,My Policeman,"In the late 1990s, the arrival of elderly invalid Patrick into Marion and Tom’s home triggers the exploration of seismic events from 40 years previous: the passionate relationship between Tom and Patrick at a time when homosexuality was illegal.Let it take hold of you"
965150,Sophie reflects on the shared joy and private melancholy of a holiday she took with her father twenty years earlier. Memories real and imagined fill the gaps between miniDV footage as she tries to reconcile the father she knew with the man she didn't.,Memory burns.,Aftersun,Sophie reflects on the shared joy and private melancholy of a holiday she took with her father twenty years earlier. Memories real and imagined fill the gaps between miniDV footage as she tries to reconcile the father she knew with the man she didn't.Memory burns.
1024546,"As Los Angeles prepares for Halloween, mask-wearing armed robbers critically wound detective James Knight’s partner in a shootout following a heist. With Knight in hot pursuit, the bandits flee L.A. for New York, where the detective’s dark past collides with his present case and threatens to tear his world apart…unless redemption can claim Knight first.",,Detective Knight: Rogue,"As Los Angeles prepares for Halloween, mask-wearing armed robbers critically wound detective James Knight’s partner in a shootout following a heist. With Knight in hot pursuit, the bandits flee L.A. for New York, where the detective’s dark past collides with his present case and threatens to tear his world apart…unless redemption can claim Knight first."
933965,"Trailblazing, hell-raising country music legend Tanya Tucker defied the standards of how a woman in country music was supposed to behave. Decades after Tanya slipped from the spotlight, rising Americana music star Brandi Carlile takes it upon herself to write an entire album for her hero based on Tanya’s extraordinary life, spurring the greatest comeback in country music history. Taking stock of the past while remaining vitally alive in the present and keeping an eye on the future, The Return of Tanya Tucker is a rousing exploration of an unexpected friendship built on the joy of a perfectly timed creative collaboration.","A trailblazing, hell-raising, music legend. A genre-defining musical force of nature. An unexpected friendship that led to the greatest comeback in country music history.",The Return of Tanya Tucker: Featuring Brandi Carlile,"Trailblazing, hell-raising country music legend Tanya Tucker defied the standards of how a woman in country music was supposed to behave. Decades after Tanya slipped from the spotlight, rising Americana music star Brandi Carlile takes it upon herself to write an entire album for her hero based on Tanya’s extraordinary life, spurring the greatest comeback in country music history. Taking stock of the past while remaining vitally alive in the present and keeping an eye on the future, The Return of Tanya Tucker is a rousing exploration of an unexpected friendship built on the joy of a perfectly timed creative collaboration.A trailblazing, hell-raising, music legend. A genre-defining musical force of nature. An unexpected friendship that led to the greatest comeback in country music history."
615952,"In 1980, Queens, New York, a young Jewish boy befriends a rebellious African-American classmate to the disapproval of his privileged family and begins to reckon with growing up in a world of inequality and prejudice.",The end of an era. The beginning of everything.,Armageddon Time,"In 1980, Queens, New York, a young Jewish boy befriends a rebellious African-American classmate to the disapproval of his privileged family and begins to reckon with growing up in a world of inequality and prejudice.The end of an era. The beginning of everything."
579496,A married woman with an unwanted pregnancy lives in a time in America where she can't get a legal abortion and works with a group of suburban women to find help.,You are not alone.,Call Jane,A married woman with an unwanted pregnancy lives in a time in America where she can't get a legal abortion and works with a group of suburban women to find help.You are not alone.
595586,"A US soldier suffers a traumatic brain injury while fighting in Afghanistan and struggles to adjust to life back home in New Orleans. When she meets local mechanic James, the pair begin to forge an unexpected bond.",Begin again.,Causeway,"A US soldier suffers a traumatic brain injury while fighting in Afghanistan and struggles to adjust to life back home in New Orleans. When she meets local mechanic James, the pair begin to forge an unexpected bond.Begin again."
676547,"In response to a global rise in demonic possessions, the Catholic Church reopens exorcism schools to train priests in the Rite of Exorcism. On this spiritual battlefield, an unlikely warrior rises: a young nun, Sister Ann. Thrust onto the spiritual frontline with fellow student Father Dante, Sister Ann finds herself in a battle for the soul of a young girl and soon realizes the Devil has her right where he wants her.",It wants in.,Prey for the Devil,"In response to a global rise in demonic possessions, the Catholic Church reopens exorcism schools to train priests in the Rite of Exorcism. On this spiritual battlefield, an unlikely warrior rises: a young nun, Sister Ann. Thrust onto the spiritual frontline with fellow student Father Dante, Sister Ann finds herself in a battle for the soul of a young girl and soon realizes the Devil has her right where he wants her.It wants in."
532870,A woman runs for her life though the streets of Los Angeles after her blind date suddenly turns violent.,A first date from hell.,Run Sweetheart Run,A woman runs for her life though the streets of Los Angeles after her blind date suddenly turns violent.A first date from hell.
823766,"Haunted by her past, a nurse travels from England to a remote Irish village in 1862 to investigate a young girl's supposedly miraculous fast.",,The Wonder,"Haunted by her past, a nurse travels from England to a remote Irish village in 1862 to investigate a young girl's supposedly miraculous fast."
878183,"It's the final weeks of the most consequential presidential election in history. America is poised to elect either its first female president or its first viable independent candidate. Reporting history as it's made, an idealistic young journalist teams up with her idol, legendary journalist Nick Booker, to uncover a conspiracy that places the fate of the election, and the country, in their hands.",Follow the lies. Find the truth.,The Independent,"It's the final weeks of the most consequential presidential election in history. America is poised to elect either its first female president or its first viable independent candidate. Reporting history as it's made, an idealistic young journalist teams up with her idol, legendary journalist Nick Booker, to uncover a conspiracy that places the fate of the election, and the country, in their hands.Follow the lies. Find the truth."
829280,"Now a detective-for-hire like her infamous brother, Enola Holmes takes on her first official case to find a missing girl, as the sparks of a dangerous conspiracy ignite a mystery that requires the help of friends — and Sherlock himself — to unravel.",Go Big. Go Holmes.,Enola Holmes 2,"Now a detective-for-hire like her infamous brother, Enola Holmes takes on her first official case to find a missing girl, as the sparks of a dangerous conspiracy ignite a mystery that requires the help of friends — and Sherlock himself — to unravel.Go Big. Go Holmes."
560052,"Struggling to cope after a move to the city with his mother, Elmer runs away in search of Wild Island and a young dragon who waits to be rescued. Elmer’s adventures introduce him to ferocious beasts, a mysterious island and the friendship of a lifetime.",,My Father's Dragon,"Struggling to cope after a move to the city with his mother, Elmer runs away in search of Wild Island and a young dragon who waits to be rescued. Elmer’s adventures introduce him to ferocious beasts, a mysterious island and the friendship of a lifetime."
